section_name,thread_title,post_ID,post_date,post_username,post_text,post_order,replier_post_ID,user_birthday,user_location,user_gender,user_occupation,user_messages_count,user_reaction_score,user_car,user_about,user_member_type
Mercedes-Benz,SPIED! Mercedes-Benz S-Class Coupe caught on camera again,post-627618,"Mar 11, 2013",Mark,,#1,,,"Tampa, FL",NA,NA,"16,982","6,557","2011 BMW X5 xDrive35d (E70),2006 BMW 650i Cabriolet (E64),1999 Mercedes-Benz C230 Kompressor (W202),1998 Mercedes-Benz E320 (W210),1994 Jaguar XJ6 (XJ40)",,Staff member
Motorsports,BMW's F1.07 to Drive Nordschleife,post-181632,"Apr 28, 2007",bum-man,"LOL, what would have been hilarious is the look of Heidfeld's face as the M5 ring taxi passed him.",#22,post: 181625,"Aug 6, 1985
										
											(Age: 37)",NA,NA,NA,"3,576","1,161",,,NA
Motorsports,BMW's F1.07 to Drive Nordschleife,post-181699,"Apr 29, 2007",Matt,How do you pull an 8.34 time in an F1 car going at those speeds??? THat doesnt make sence.,#24,,,"Los Angeles, California",NA,Student,"3,136",195,,"Im a college student.,Cars, dirt biking, waterskiing ect.",NA
Mercedes-Benz,Classic Mercedes-Benz photos,post-402022,"Aug 10, 2009",thebenzbar,"W123 coupes may soon to be classics, if not already",#135,,,S.Florida,NA,NA,2,2,"a diesel and a petrol,C63 AMG","Cars,300CD-T,E55 AMG",NA
Mercedes-Benz,Mercedes-Benz C63 AMG Black Series -  First Drives/Tests Thread,post-552317,"Dec 19, 2011",molotow,,#22,,NA,NA,NA,NA,43,45,,,NA
Motorsports,Peugeot 908 HDi - Le Mans challenger.,post-138691,"Jan 14, 2007",Choleric,"PEUGEOT 908 – LE MANS CHALLENGER POWERED BY HDi,Peugeot’s road car HDi diesel technology is to be showcased in Le Mans endurance series in 2007,New V12 HDi DPFS diesel engine to power Peugeot 908 racecar,On 14 June 2005, Peugeot announced its decision to take up a new technological challenge: to win one of the most prestigious and most demanding motor races in the world, the Le Mans 24-hour race, with the Peugeot 908, a car powered by a V12 HDi diesel engine, equipped with a diesel particulate filter system (DPFS).,This new car will follow in the footsteps of the legendary Peugeot 905, winner of the World Sports Car Championship and Le Mans 24-hour race in 1992 and the historic one, two, three finish in 1993.,Unlike the 905 which was powered by a 3.5-litre V10 petrol engine, the new contender will be powered by a 5.5-litre 100o V12 HDi diesel engine. This is the maximum engine size that regulations allow and was chosen for its efficient operation at low engine speeds. It also enables engine power to be limited in the first instance, but also enables further development.,The level of performance expected – more than 515kW (700 bhp) of power and a torque output greater than 1,200 Nm – is without precedent in a diesel engine and is a direct result of Peugeot’s current level of know-how in diesel technology, linked to the mechanical characteristics of the V12.,The choice of a V12 engine helps keep the cylinder bore diameter very close to that of a production series engine. In doing so, Peugeot can call on its extensive knowledge of diesel combustion, obtained during the development of the current HDi diesel engines. It also ensures the engine has a reasonable length piston stroke.,The V12 architecture, well known for its good balance, also reduces vibration to a minimum. The V12 engine uses a 100o V angle for its architecture, which has allowed its centre of gravity to be lowered without affecting the torsional rigidity of the engine.,Two diesel particulate filters are mounted at the end of each of the exhaust systems. Through technology which has come directly from production cars, they will provide a guaranteed control of exhaust emissions under all operating conditions.,Back in 2000, Peugeot confirmed its commitment and strategic policy to reduce exhaust emissions, with the fitment of a diesel particulate filter system (DPFS) as standard equipment on the HDi diesel engine in the 607. The success of this commitment was demonstrated in December 2005 when Peugeot celebrated the production of the one-millionth vehicle fitted with a diesel particulate filter system.,Today, it is the production car which brings its HDi diesel particulate filter technology to the competition arena, in order to show its qualities in extreme conditions of endurance and performance, all the while respecting the environment.",#2,,,Great Plains,NA,NA,"3,764","1,770","A4,Audi 90 S,S8",,NA
Mercedes-Benz,Mercedes benz SL R231 + Edit!,post-552176,"Dec 18, 2011",BMWM2,Hi,#1,,NA,NA,NA,NA,3,2,,,NA
Motorsports,Best drift car!,post-102009,"Oct 15, 2006",dyna-niet,"maybe a z4 m coupe or if you had the money, i would buy a mb clk dtm",#7,,"Feb 7, 1985
										
											(Age: 38)",Netherlands,NA,NA,380,136,,///M SiMplY THe BesT,NA
Mercedes-Benz,"Mercedes M-Class (W163) Development, testing, and production",post-560761,"Feb 4, 2012",Ham8,"Very interesting video, I hope Mercedes fans will enjoy",#1,,NA,NA,NA,NA,104,290,,,NA
Mercedes-Benz,Heritage preserved from decay: W116 280 SE as a fair-weather car,post-562491,"Feb 12, 2012",Atatexan,"Does anyone know the part numbers and where to purchase the ""Koni modified suspension"" described in the post? Gorgeous W116.",#9,,NA,NA,NA,NA,3,0,,,NA
Motorsports,Mika Hakkinen vs Kimi Raikkonen,post-74972,"Jun 24, 2006",YoungWarrior,montoya is overrated and disapointing. A bit of a flop as he cost MB the championship last year and kimis title because he kept crashing and doing the friendly fire thing.,#13,,"Jan 9, 1989
										
											(Age: 34)",NA,NA,NA,625,6,,"""Aerodynamics are for people who cannot build engines"" - Enzo Ferrari",NA
Motorsports,STR set to continue V10 use,post-56474,"Apr 12, 2006",drronh,Interesting- SRT also continues to use V10s in the Viper and their pickup trucks,#2,,,"Naples, Florida",NA,NA,500,158,"RS4 Cab, 997GT3 RS, C6Z06, 3500 Ram dually, 996GT3, Viper GTS, 993TT, turbo 3.6, 9000 aero, 930, 916, 914-6 GT,ML500, Gallardo, 996C4S, allroad, Cooper S, C5Z06, Passat GLX, 500SEL...","Current: RS4 Cab, 997GT3 RS, C6Z06, 3500 Ram dually, 996GT3, Viper GTS, 993TT, turbo 3.6, 9000 aero, 930, 916, 914-6 GT,Gone: ML500, Gallardo, 996C4S, allroad, Cooper S, C5Z06, Passat GLX, 500SEL...",NA
Motorsports,Zonda GR in FIA GT,post-57106,"Apr 15, 2006",Lemantech,the reason they didn't win was because it doesn't use mercedes engines......mercedes wouldn't let pagini have them...so I guess after that Pagini was pretty much screwed.,#10,,,London,Male,Doc,972,58,"None at the moment.,MK5 GTI,Singer 911",,NA
Motorsports,FIA: Max Mosley to quit in 2009,post-45481,"Feb 27, 2006",yomomwhat,"er....how does he have his replacement lined up? its meant to be done by voting? lol, he should go now.....he just wants to screw F1 over then leave lol",#4,,"May 23, 1987
										
											(Age: 36)",NA,NA,NA,357,30,,,NA
Motorsports,FIA: Max Mosley to quit in 2009,post-45468,"Feb 27, 2006",vabboud,buit the scary part is :,#2,,"Oct 14, 1987
										
											(Age: 35)",NA,NA,NA,945,231,,,NA
Motorsports,New knockout qualifying format to be revised: loophole was found,post-22141,"Dec 10, 2005",Carbon,"I thought the 2005 season was really great, especially compared to the last few years.  The constant regulation changes in the name of cost-cutting and things of that sort are ridiculous.  It is stupid because cutting costs in F1 is almost impossible, so you'll basically have slower cars that still cost a hell of a lot of money to develop, produce, and race.,An interesting article on this:,""By far the biggest source of discontent that exists in the sport is the fact that Ferrari gets more money than the other teams, even if it does not perform."",I'd never heard anything about this before, anyone have any more info?",#4,,,"Los Angeles, CA",NA,Student,805,9,,,NA
Mercedes-Benz,Mercedes-Benz S400 BlueHYBRID,post-329038,"Sep 12, 2008",Family Guy,"Has anyone found lexus fanboy posts or comments on this car on other sites?,cause its an absolutly hilarious to read",#4,,,"Melbourne, Australia",NA,NA,177,20,Audi R8 V12 TDI,,NA
Mercedes-Benz,RENNtech plans Pikes Peak rally-style Mercedes-Benz GLK,post-326458,"Aug 30, 2008",ducati1482,"Renntech's office is about 10 minutes from where I live(while in the states), so I get to see all of their fabulous work, that being said, what were they thinking?????,They do suck amazing work and styling, and then they come out with this Jeep SRT lookalike",#4,,,"Boca Raton, FL . Rotterdam, NL . Iceland",NA,NA,57,68,"2008 Audi RS4,2007 Ducati 1098S,2008 Infiniti M45,McLaren F1","Motorcycle Racing,FORZA DUCATI",NA
Mercedes-Benz,Mercedes-Benz S400 BlueHYBRID,post-331529,"Sep 22, 2008",SCOTT27,,#32,,,"Berlin, Germany",NA,NA,"18,570","23,403",Dark Frozen Red Sorbet.,Hail...COBRA.,NA
Mercedes-Benz,Sl 63 amg yellow colour,post-371545,"Mar 19, 2009",hiu,"WHAT YOU THINK....???,WHAT YOU MEAN....???,IF YOU HAVE SL 63 AMG YELLOW COLOUR.....???,FIRST ON THE PLANET,REGARDS,HIU",#1,,NA,NA,NA,NA,4,6,,,NA
Mercedes-Benz,Mercedes-Benz S400 BlueHYBRID,post-331767,"Sep 23, 2008",Potential,What another thread full of fighting and complaining. I'm over this site... This is becoming worse The View...,#69,,,Australia,NA,NA,807,284,"BMW 750i, BMW 335i,BMW 530i, MB E500,Rolls Royce Drophead Coupe",,NA
Mercedes-Benz,Sl 63 amg yellow colour,post-486809,"Oct 26, 2010",magnum,"here in my town lives the director of the italian edition of playboy..,and he have a yellow mercedes sl600!!,i did a photo to his car once while he was parking..",#49,,,"Veneto, Italy",NA,NA,17,4,"2006 BMW 535d Touring 2011 -&gt; ...,2005 VW Touareg V8 2006 -&gt;2011,1991 BMW e34 520i 2010 -&gt; 2012,1989 BMW e30 318i 2011 -&gt;2011 Wrecked,2000 Fiat Punto 1.2 16v 2006 -&gt; 2010","If you train like mickey mouse... your body will be like mickey mouse,People hates accountants... only because we know how to pay less taxes!",NA
Mercedes-Benz,Gearbox numbers do they suit my 2002 s-class 320 cdi?,post-471489,"Jul 15, 2010",tallboyandy23,,#1,,NA,NA,NA,NA,8,1,,,NA
Mercedes-Benz,2011 Mercedes CLS (Spy shots & Info),post-333317,"Sep 27, 2008",Breadbaker,"The next CLS will be incredible. Since it is sharing its platform with the S class, Im expecting an S class price tag too. But to compete with BMW's Concept CS and the AM Rapide it will have to grow in size and and the interior will have to be on par with the S class which the current CLS is definetly not. Mercedes definetly needs to take there time with this one because the BMW Concept CS is one of the best looking cars ive seen, so they have very stiff competition.",#19,,NA,NA,NA,NA,32,39,,,NA
Mercedes-Benz,[PDF scans] Car and Driver - Mercedes SLS AMG test,post-467088,"Jun 16, 2010",hilalpro,[image no longer available],#1,,,Morocco,NA,NA,114,61,,,NA
Mercedes-Benz,2011 Mercedes CLS (Spy shots & Info),post-334693,"Oct 2, 2008",JadeVetti,"2010/2011 are looking more and more like promising auto years to buy a new vehicle.,I liked the CLS then, and the spy shots now haven't wavered that.",#33,,August 25,"Long Island, New York, USA",NA,NA,742,334,"Secondary, nowadays.,10,000 horses in a Dream Stable.  Could be 10 cars, maybe 5 cars...","caliber, Caliber, caliber...Did I say caliber?,Reading, writing, cooking, sex and cars.,I want my inner circular headlights rimmed a glowing red. That way, scurry when you see my demon advancing.",NA
Mercedes-Benz,2011 Mercedes CLS (Spy shots & Info),post-351802,"Dec 12, 2008",Alwing,"As andyvalencia already pointed out, the rear does resemble to Huckfeldt's impression. Despite its heavy camouflage, the shape of the trunklid and the cut-out of the rear bumper. Also the rear lights stretching far inwards.,Anyway, Huckfeldt seems to be wrong about one thing and that is the positioning of the rear-view mirrors. It's not attached near the pillar of the window anymore but on the door itself as can be seen on the photos. I find it to be an interesting development since all Mercedes cars except certain classics don't have mirrors attached like that.,Assuming that the mirrors will stay that way, I believe the car must be pretty wide on the flanks otherwise it would look kind of odd in my opinion.,[image no longer available]",#60,,"Nov 14, 1984
										
											(Age: 38)",NA,NA,NA,376,678,,,NA
Mercedes-Benz,Mercedes-Benz SL 73 AMG: The ultimate roadster,post-443415,"Feb 14, 2010",adeel2010,One of my all time favorite Mercedes,#2,,,"Indiana, USA",NA,senior in high school,272,176,"Chrysler 300 Limited,Lamborghini Reventon","Mercedes-Benz enthusiast,street racing",NA
Mercedes-Benz,Car buying advice,post-448613,"Mar 8, 2010",Silverado,When's the facelift due? If it's anything later than mid-2010 you might as well wait for the next generation 3 series due out in 2012. At least it's a new model with a full 7-years to go in its life cycle vs the W204's 3+ years.,#28,,NA,NA,NA,NA,15,2,,,NA
Mercedes-Benz,2011 Mercedes CLS (Spy shots & Info),post-366826,"Feb 21, 2009",delatobi,well i dont think so.,#140,post: 366756,NA,NA,NA,NA,58,52,"bmw coupé,flügeltürer",,NA
Mercedes-Benz,2011 Mercedes CLS (Spy shots & Info),post-369051,"Mar 4, 2009",Vivaki,"If you look at the current CLS interior, it is similar the W211 E class but more luxurious and expensive with the big slab of wood etc and I think it will be the same case with the new one. Judging by this pic it looks as though it has the same nav screen as the new E class.,[image no longer available]",#147,,"Feb 4, 1982
										
											(Age: 41)","England, UK",NA,NA,730,681,,,NA
Mercedes-Benz,Help with our new E :-),post-400129,"Aug 3, 2009",Chung_Chieh,"Mr_Mercedes, are you attending the E-Klasse Drive event tomorrow at Albert Park? Mine's the 9am session. I wonder what cars they'll bring. I saw a Greenish Coupe driving down Lygon a few days ago; stands out!",#60,,NA,NA,NA,NA,13,3,,,NA
Mercedes-Benz,Autocar - Merc plans SLS Black Series,post-421817,"Oct 31, 2009",Bilal,I have also read from two independent sources from MBWorld who toured AMG's facilities in Affalterbach and were told that the 63 engine can produce around 700bhp with conventional tuning.,#2,post: 421815,,"Manchester, UK",NA,Trainee barrister,201,367,SL63 AMG.,,NA
Mercedes-Benz,2011 Mercedes CLS (Spy shots & Info),post-394674,"Jul 9, 2009",H50,I found these pics it was spotted in Dubai testing..,#224,,NA,NA,NA,NA,257,147,,,NA
Mercedes-Benz,Picked up new car,post-411169,"Sep 13, 2009",Verbier,"No tracking problems with my E350 CDI Coupe AMG and it's done 9,000km now.  It's true that it's no sports car, the size and weight precludes that.  However it is a very good GT car and can cover ground very quickly.",#12,,,Switzerland,NA,NA,27,42,,,NA
Mercedes-Benz,2011 Mercedes CLS (Spy shots & Info),post-410880,"Sep 11, 2009",Will,"Damn, FEP please,I like the mirrors being on the door though",#246,,,"Manchester, UK",Male,AutoTrader,404,228,"Vauxhall Corsa 1.2,Seat Ibiza 1.2,BMW Z4 E85 2.0,Seat Leon Cupra 300,Audi A5 2.7,BMW M3 (E90)",,NA
Mercedes-Benz,Picked up new car,post-409725,"Sep 8, 2009",westsider,Congratulations dude! I am waiting for delivery of my E250 Coupe. I have gone for it in black with sports kit and opted for memory pack for seats. I cant wait. Am currently driving a 320i 2006 model so will be interested to see how they compare!,#9,,NA,NA,NA,NA,1,0,,,NA
Mercedes-Benz,Brabus W212 E V12,post-412298,"Sep 17, 2009",AYA,"Wow. This thing almost put me off the W212 for good.,I'm just surprised as to why Brabus would bother with such a monstrosity. They proved with the Rocket that their cars don't need to look so hideous.,Let's get one thing settled: this is not about engineering, no matter how many people try to ram this idea down our throats. This,about looks or, to be more precise, about images. The engineers at MB must be going mental because they - more than anyone - realize that you don't,to modify the top-of-the-range W212 like this to achieve the figures Brabus claims and, even if extensive modifications are necessary, most of the Brabus trinkets are more worthy of superfluous, bulky, rich-kid-pleasing, ricer-boy antics than they are of proper vehicle modification.,Comparing this to the M5? Please. The M5's V10 is more of an engineering marvel than this - fail-mobile - can ever aspire to be.,This is just a toy for immature, intellectually-stunted, vain, absurd people who are a waste of freaking oxygen - as is the Brabus biturbo. New-money rich kids trying to show off. I am not impressed.",#42,,"Mar 28, 1988
										
											(Age: 35)",Bahrain,NA,NA,16,18,,,NA
Mercedes-Benz,ADAC Breakdown Statistics: The Mercedes-Benz C-Class can be relied upon,post-387644,"Jun 4, 2009",ahmet_cagri,"A smaller one, but still a purebred Mercedes-Benz.",#4,,NA,NA,NA,NA,11,8,,,NA
Mercedes-Benz,First Mercedes-Benz E-Class Coupé delivered following the market launch,post-383569,"May 16, 2009",sfbayfan,"WOW, the E Coupe looks,from that angle in the 1st photo.,Is that Heidi Klum's mother in the photos?  (and what is up with that pose in the 1st photo, LOL).  I thought MBZ was going for a younger demographic with the new E Coupe???",#5,,April 8,"San Leandro, California, United States",NA,SVP Operations,95,22,"2011 Mercedes Benz E350,BMW 530i (E39),Hmm???","California Native, Bay Area Resident,High Energy, Trance music, Eminem, Lady Gaga, Katy Perry",NA
Mercedes-Benz,***Mercedes E-Class Coupe Premiere in Munich***,post-382205,"May 10, 2009",NevadaJack,"Nice job wimmer.  You continue to shoot great images and the video quality looks fine... except too much panning instead of some fixed shots and then edited.  I understand the shooting situation though and realize you wanted to document the entire car.  Good stuff...,Exterior looks great but the interior is too much C Class.  I expected a totally new design concept and it looks just like my new C350 except mavbe for the instrument panel.  Will take a closer look when it hits the showrooms here.",#13,,,"Las Vegas, NV  USA",NA,Retired in 1987,"1,770","1,343","2011 E350 Cabriolet.  Artic White/Almond/Mocha Leather with Beige Top,2009 C350 Sport,2008 SL550,2008 GL550,2007 S550,2006 S430,2003 E320,They have not built it yet....","Retired Navy, then Director of the National AudioVisual Center in Washington.,Mercedes and Computers,2011 E350 Cabriolet- Artic White,Mocha/Almond. Beige Top",NA
Mercedes-Benz,"""designo Selector"" for CL",post-375962,"Apr 9, 2009",racanada04,"I think it is, look also at the steering wheel which is similar to the new FL S class, looks very nice indeed",#4,,NA,NA,NA,NA,30,3,,,NA
Mercedes-Benz,"""designo Selector"" for CL",post-375960,"Apr 9, 2009",ich,Is this also the Facelift? Look at the different side mirrors... This is an absolut Beauty!,#2,,"May 17, 1988
										
											(Age: 35)",Papenburg...,NA,NA,62,129,,"Drive it, like you stole it!",NA
Mercedes-Benz,2011 Mercedes CLS (Spy shots & Info),post-418095,"Oct 14, 2009",BKK-ES,The rear is super nice.,#386,,NA,NA,NA,NA,199,119,,,NA
Mercedes-Benz,G-wagen: Spares & Accoseries,post-369394,"Mar 5, 2009",Santa,"Maybe this link helps?,G-Manufaktur",#3,,,"NJ, USA",NA,Retired,7,0,"2008 G55,2006 E320 CDI,1996 SL320,1994 E320 Cabrio,BMW • Audi • Peugeot • Mercedes • Chevrolet • Volkswagen • Plymouth • Oldsmobile • Land Rover • Jeep •  Triumph • 49 cars since 1976,AMG G-63","Cars, Mac Computers",NA
Mercedes-Benz,First Official SLR Roadster Pictures!!!!,post-183247,"May 4, 2007",zetableh,"Who gave Mercedes permission to make a car that's SO UNDENIABLY SEXY?!,I'll take the blue demo car if that's what it takes to get my hands on one... blue and tan leather = dream,EDIT: And can you imagine the sound when you're going flat out with the top down?!",#16,,"May 25, 1986
										
											(Age: 37)",Connecticut/New York,NA,Student (Accounting Major),776,115,"2008 Subaru Impreza 2.5i,5-door, Newport Blue Pearl","I'm a college student.,Building model cars, performing a cappella music",NA
Mercedes-Benz,Top Safety Pick 2008: The Mercedes-Benz C-Class gains top marks in US safety test,post-351217,"Dec 9, 2008",Osnabrueck,"This isn't a huge deal - cars that share the IIHS ""Midsize Cars"" honor are:,Acura TL,Acura TSX,Audi A3,Audi A4,BMW 3 series,4-door models,Ford Fusion,with optional electronic stability control,Honda Accord,4-door models,Mercedes C class,Mercury Milan,with optional electronic stability control,Saab 9-3,Subaru Legacy,Volkswagen Jetta,Volkswagen Passat,I guess if anything is of note here - it's the,of Lexus and Infiniti from this list. All the Germans and Acura made the cut.",#5,,"Oct 24, 1977
										
											(Age: 45)",NA,NA,NA,"2,825",872,,What is it with Benzes and knocking things down? -Merc1,NA
Mercedes-Benz,First Official SLR Roadster Pictures!!!!,post-183436,"May 5, 2007",El Zorro,"Actually, the concept car of the SLR (called ""Vision SLR"") was a roadster, not a coupé. So one could say the SLR was originally designed as a roadster...,I think it looks stunning... especially in that deep blue colour with the tan leather seats",#24,,,Belgium,NA,NA,509,472,,,NA
Mercedes-Benz,2000 S-class radio conversion,post-344838,"Nov 12, 2008",alfa,"I have a Becker audio 30 radio cassette in my 2000 W220. It has a cassette in the middle and a CD changer in the back.,it looks like this,The question is assuming i am able to get a new wood trim can i convert my radio to a command module similar to this?,1. Is this a plug and play thing or do i need to do some electrical conversions,2. Do i need to do some kind of splicing?,3. Can i keep the trunk mounted CD changer?,4. Assuming that i have the cassette or the command radios can, and if i can, how do i add hardwired iPod connections?,5. The only reason i'm adding the one with the screen is to enable my kids to watch DVD's and if possible iPod VIdeos, since this is my main objective case anyone here have a better idea.,I'm not inclined to the idea of installing after market radios and LCD screens no matter how good they look.,TIA,alfa",#1,,NA,NA,NA,NA,2,0,,,NA
Mercedes-Benz,Order the Sports Interior package separet from Sports Exterior/Off Road styling?,post-345172,"Nov 14, 2008",coligny,"If it was for a run of the mill Honda Jazz... bend over and buy what they have...,For a GL Class... tell them what you want (since it's just a configuration available but not locally, nocing extravagant). And mention it's this or no sale.,Forced bundling is illegal in most countries...",#3,,NA,NA,NA,NA,124,20,"Audi A4 Full scale Lemon (but in lazer red),Nissan Note (That thing 'Just Work™')",**** Sarkozy and his minions.,NA
Mercedes-Benz,2011 Mercedes CLS (Spy shots & Info),post-428797,"Dec 7, 2009",merc4,"I am afraid but it is probably what it is going to look like in reality. All mules have from the beginning interiors that are going to be in the production version (sometimes without wood or other decoration, but the design is set). Let us not forget that the premier is next year, they surely would not prepare one interior just to fool us. Also the central air vents are the same as E class, that is for sure from the other interior photo, so the only difference could be the radio and aircon location. And I do not think they could do some magic with it, the only possibility was to let it be and only change the aircon controller. I am really very disgusted and frustrated but what can we do. Also when you look at the present CLS, its interior is similar to that of the old E-class, just a little bit of higher quality, but the same layout. The only difference is in the upper part where the CLS has a big chunk of wood. It also was in the first time only a vision car, so they could prepare some more stylish and extravagant interior. The only hope now is the exterior.",#553,,NA,NA,Male,NA,231,257,,,NA
Mercedes-Benz,2011 Mercedes CLS (Spy shots & Info),post-429165,"Dec 9, 2009",data,"Seeing the photo with the note found inside the wheel of the commands have a different arrangement of the model on the door panel detection.,Because unless I'm mistaken this seems like the roulette comand and is inclined rather than horizontal as in the later photos is the console of the current E,[image no longer available]",#590,,,Spain,Male,NA,103,254,,,NA
Mercedes-Benz,Road and Track - Road Test Update: 2009 Mercedes-Benz SL63 AMG,post-320826,"Aug 4, 2008",Dazone,"I got the Sl63 last month and it is definitley one of the top cars I have ever had. I wish they would of updated the inside, but it is still the best driving Benz I have owned. And the pictures do it no justice.",#3,,NA,NA,NA,NA,2,0,,,NA
Mercedes-Benz,2011 Mercedes CLS (Spy shots & Info),post-435647,"Jan 11, 2010",Tomislav,"the structure, i can see look really great .it shows the new and current design direction of MB.we will see more soon.",#684,,NA,NA,Male,NA,21,3,,,NA
Mercedes-Benz,Carlsson Aigner CK65 RS Blanchimont,post-319233,"Jul 27, 2008",speed_kills,I think we need to hire a hitman to assassinate the guy who design this paint job. What a mental diarrea...,#5,,NA,NA,Male,NA,664,141,"Alfa Romeo Mito 1.6 JTDM and Peugeot 208 1.4 HDI,Peugeot 306 1.4i,Lotus Exige","""To,, just,""",NA
Mercedes-Benz,"W212 E-Class, new edge of the W124 E-Class?",post-315257,"Jul 10, 2008",Jng,This cluster shape has been present in many Mercedes. It was a constant design cue like the stripped taillights and I am happy it could return.,#7,,NA,NA,NA,NA,22,5,,,NA
