section_name,thread_title,post_ID,post_date,post_username,post_text,post_order,replier_post_ID,user_birthday,user_location,user_gender,user_occupation,user_messages_count,user_reaction_score,user_car,user_about,user_member_type
Maserati,"Ciao, Bella: An Italian Opera in Four Doors",post-1556,"Oct 2, 2005",Yaz,"I enjoyed reading this in today's NY Times Auto. Section. Enjoy,Article:",#1,,,New York City,Male,NA,"5,159","4,230",Lexus GS-F,"""///AMG, an unending rush of power and adrenaline!""",NA
Motorsports,Mercedes GP 2013 Engine Q&A,post-645289,"Jun 19, 2013",Wunderkind,"As a F1 fan, I hope BMW never re-enters F1 because it has shown that it has no backbone and will quit the sport at it's own convenience when things do not go it's way.,BMW, stay away from F1.",#3,post: 645269,NA,NA,NA,NA,"2,274","1,240",,,NA
Motorsports,Lewis Hamilton signs for Mercedes-Benz 2013,post-601946,"Oct 3, 2012",andra smith,"Kind of seen it coming! However, I have to ask myself why? Currently the mclaren is the best car, the merc is a bit of a dog in reality!,I hope he hasn't been totally motivated by the money aspect of things, he already has way more then anyone really needs!,Will be watching with interest to see what he can do with them next year!,Sergio Perez replaces him and signs for McLaren.",#1,,"Jan 18, 1980
										
											(Age: 43)",NA,Male,NA,1,0,,,NA
Toyota,"Toyota recalls 160,000 Prius hybrids due to software glitch",post-4804,"Oct 14, 2005",EnI,Source:,#1,,NA,NA,Male,NA,"14,030","12,867",,,NA
Motorsports,TMG EV P002 Electric Lap World Record Nürburgring Nordschleife 7:22,post-601770,"Oct 2, 2012",Soup,,#1,,NA,NA,NA,NA,"8,313","23,014","A to Z,Formula-One 1:43",,Premium Supporter
Mercedes-Benz,GLC 63 paint the black plastic trims,post-923494,"Mar 2, 2019",Benzone,Hello... has anyone attempt to paint the black plastic trims to match on glc63? Thanks,#1,,NA,NA,NA,NA,1,0,,,NA
Mercedes-Benz,Mercedes-Benz GLC (X253),post-751693,"Jun 17, 2015",HighestOfHigh,Mercedes did an outstanding job with the design. I absolutely love the interior. This is a million times better than the GLK.,#39,,September 11,DC,Male,NA,"9,364","5,052",Mercedes-Benz S65 AMG,HighestOfHigh,NA
Motorsports,2011 Spanish GP,post-518223,"May 24, 2011",Remy Zero,"No doubt this year has tonnes of passing, someone has to stop Vettel and RedBull.",#15,,,Malaysia,NA,HR Analyst,"3,087","4,369",,"Lifting weights,Never, Never, Never Give up...",NA
Motorsports,Celebrating 40 years since the first Porsche victory at Le Mans,post-466336,"Jun 11, 2010",Giannis,"On 14 June 1970, Porsche claimed the first of what would become 16 overall victories in the world’s most prestigious endurance race, the Le Mans 24 Hours. After precisely 4,607.811 kilometres – or 343 laps – Hans Herrmann and Richard Atwood were first across the finishing line in the legendary Porsche 917 KH from Porsche Salzburg, which bore the starting number 23. Gerard Larrousse and Willy Kauhsen in the Martini Porsche 917 LH, followed by Rudi Lins and Helmut Marko in the Porsche 908/02 took second and third places respectively, making it a total triumph for Porsche.,However, the road to this victory was by no means an easy one for Porsche. The Zuffenhausen sports car manufacturer had been racing at the Sarthe circuit since 1951, achieving numerous class wins thanks to intrinsic Porsche qualities such as lightweight construction, aerodynamics and reliability. In 1969, Porsche was pipped to the post in the closest ever Le Mans race, with Herrmann and Larrousse in the Porsche 908 finishing just 75 metres – around one second – behind the Ford GT 40 of Jacky Ickx.,In the anniversary year of 1970, all the signs pointed towards an offensive that would finally see the much longed-for overall victory in Le Mans go to Stuttgart. The Porsche 917 was destined for victory, having made its debut just a year earlier. On 21 April 1969, the 25 Porsche 917s were approved by the homologation commission in Zuffenhausen. The cost of materials alone exceeded DM 5 million. The Porsche 917, developed by Ferdinand Piëch, was unveiled at the Geneva Motor Show. This new ‘ultimate’ Porsche quickly caused a stir among rival competitors. Weighing in at close to the minimum weight of 800 kilograms, it went on to become one of the fastest and most successful racing cars of all time. The lightweight 12-cylinder engine delivered up to 580 hp at 8,400 rpm with a displacement of 4.5 litres. This enabled the long-tail version to reach speeds approaching 400 km/h (248 mph) on the 5,823 metre-long Hunaudières straight at Le Mans.,In the run-up to the 1970 race, it was clear that the lessons learned from previous years had been worthwhile. Realising that rash manoeuvres in the first few hours of this classic endurance race would ultimately end in failure, Porsche made the experienced Hans Herrmann its first choice as driver. The Sindelfingen veteran combined speed and good sense. Together with Englishman Richard Attwood, he started in the 4.5-litre short-tail version bearing the number 23, which was painted in the red and white colours of Porsche Salzburg. The team’s second car, featuring a 4.9-litre engine and long-tail body, was driven by Vic Elford and Kurt Ahrens. A further three Porsche 917s were entered by John Wyer along with the psychedelic-coloured 4.5-litre long-tail version of the Martini team. There was also an entire armada of 907, 908, 910, 911 S and 914/6 models. At precisely 4 p.m. on 13 June, 24 Porsche cars stood at the starting line in Le Mans. By the next day there were still 12 remaining, five of which were classified. The only other cars to be classified were two Ferrari 512 S – this was out of a total field of 51 starters.,This race went down in history – and not just from the perspective of Porsche – because of the disastrous weather. Vic Elford recalled how it was sometimes impossible to overtake, even on the long straights. Kurt Ahrens described it as being like sitting in a boat. And just a few weeks after his victory, Hans Herrmann admitted that driving in the rain had prompted him to make the decision to finally hang up his helmet no matter what the outcome. When leaving his house in Sindelfingen-Maichingen, his wife had asked him when he was going to give up driving, to which he responded: “When I win.”,A promise is a promise. An hour after the start, which saw the drivers begin the race sitting in their cars instead of performing the world-famous “Le Mans start”, Herrmann was only in ninth place. The race leader was Jo Siffert, also in a Porsche 917, followed by Jacky Ickx in a Ferrari 512 S. Siffert later missed a shift and blew his engine, while Ickx crashed his red racer at the chicane. At around 6:15 p.m. came the almost unbelievable news that four Ferrari 512 S had crashed into one another in the driving rain and were out of the race. The race also took its toll on the Porsche armada, with all three 917s of the Gulf team gradually dropping out.,Now was the moment for the experienced veteran Herrmann, who had the perfect partner in Richard Attwood, to show what he could do. Under the most difficult weather conditions, he gradually moved his way up the field, guiding the Porsche Salzburg 917 confidently to the first ever overall victory for Porsche at Le Mans. He realised the significance of this moment as the race came to an end on 14 June 1970: “Wow! That may have been your last lap ever as a racing driver.” Back home in Stuttgart, his victory was celebrated with a parade, in which he drove his winning car through the city to the market square. Thousands of people turned out to congratulate Hans Herrmann, ex-racing driver.,Porsche followed up this success with a further 15 overall victories at Le Mans, the second coming just a year later in 1971. In a unique Porsche 917 with a lightweight magnesium chassis, Gijs van Lennep and Dr. Helmut Marko drove to victory on a still largely chicane-free circuit. In doing so, they set an incredible record, which has never been broken. The Porsche 917 completed precisely 5,335.313 kilometres and 397 laps in 24 hours, clocking up an average speed of 222.304 km/h (138.140 mph) despite all of the pit stops and the long night. The fastest lap in the race was achieved by Jackie Oliver’s Gulf 917, with an unbelievable 244 km/h (151.6 mph) average speed, while the 917 long-tail Coupé of Elford/Larrousse was clocked at a maximum speed of 386 km/h (239.8 mph) on Hunaudières in 1971.,In 1976 and 1977 the Porsche 936 was victorious, while in 1981 it won again under Jacky Ickx and Derek Bell with a new turbo engine. Belgian driver Ickx won at Le Mans six times, four of them in a Porsche. In 1982 he was yet again part of the winning team in a triple victory that represented the first milestone for the most successful racing car of all time, the Porsche 956. Up to 1994, different variants of the 956/962 won at Le Mans seven times. 148 of these were produced in Weissach.,In some years, Porsche conceded the most important race of the year to customer teams, who emerged as frequent winners. Klaus Ludwig and the Whittington brothers thus achieved victory in Le Mans in 1979 with a Porsche 935 for the Cologne-based Kremer team, while Reinhold Joest guided the Porsche brand to well-deserved overall victories in 1984, 1985 and 1997.,Faced with the strongest ever field to line up at Le Mans in June 1998, Porsche racing director Herbert Ampferer spoke at the time of the “race of the century”. Porsche was represented with two new 911 GT1s and achieved a stunning double victory for the factory in the world’s most important endurance race, in front of a crowd of 250,000 thrilled spectators. This was the 16th and most recent overall victory for Porsche at the Sarthe circuit.,From 10 to 11 July 2010, Porsche will be celebrating this special motor sports anniversary in suitable style by taking part in the “Le Mans Classic”, an event which is only held every two years. In six classes covering model years 1923 to 1979, around 400 historic racing cars will gather to relive their old racing triumphs once more. Among them will be some of the overall winners from the Porsche Museum, which will lead an anniversary parade on the race track. Many famous drivers including Hans Herrmann and Richard Attwood will also be taking part and will be available for autograph sessions.,Hans Herrmann/Richard Attwood,Porsche 917 KH,Helmut Marko/Gijs van Lennep,Porsche 917 KH,Jacky Ickx/Gijs van Lennep,Porsche 936,Jacky Ickx/Jürgen Barth/Hurley Haywood,Porsche 936,Klaus Ludwig/Bill Whittington/Don Whittington,Porsche 935 K3 Kremer,Jacky Ickx/Derek Bell,Porsche 936 81,Jacky Ickx/Derek Bell,Porsche 956,Al Holbert/Hurley Haywood/Vern Schuppan,Porsche 956,Klaus Ludwig/Henri Pescarolo,Porsche 956 Joest,Klaus Ludwig/Paolo Barilla/John Winter,Porsche 956 B Joest,Derek Bell/Al Holbert/Hans-Joachim Stuck,Porsche 962 C,Derek Bell/Al Holbert/Hans-Joachim Stuck,Porsche 962 C,Yannick Dalmas/Mauro Baldi/Hurley Haywood,Dauer-Porsche 962 LM,Manuel Reuter/Davy Jones/Alexander Wurz,TWR Joest-Porsche WSC95,Michele Alboretto/Stefan Johannson/Tom Kristensen,TWR Joest-Porsche WSC95,Allan McNish/Laurent Aiello/Stéphane Ortelli,Porsche 911 GT1 98,Many photos availiable here:",#1,,,Greece,NA,Civil Engineer,"17,607","13,475","'05 Volvo S60 2.0T,'02 BMW 520i (E39),'90 Renault Clio 1.4 RT","A fan of old school lift-off oversteer french hatchbacks, proper steering feedback and manual gearboxes. A proponent of turbocharging, when done right. A german cars enthusiast that waits for the economy to resurrect and fill his garage with a few 911s, a 5er and a proper Benz.",Staff member
Motorsports,"2011 Impreza WRX STI Laps the Nurburgring in 7:55.0 , Faster than Panamera & CTS-V",post-466119,"Jun 10, 2010",Mr Robert,Good going! Let's hope the production version goes just as well and that this is not just a re-run of the Mitsubishi Evo IX debacle.,#17,,,Sweden,Male,Lawyer,"10,963","4,339","2010 BMW E91 320d,2012 Mercedes 220d C-class,2010 320d M,2002 320i M-Sport,2009 MINI Cooper S,1989 Mazda 323 1,6 DL,1987 VW Polo 1,6 CL",Edmunds - Insideline  We love a giant killer because it makes great headlines and there's always pressure to deliver an upset.  And I'm CURIOUS,NA
Mercedes-Benz,Tail light stops working for a while,post-878245,"Mar 11, 2018",AngeloOliveira,"Hi, good morning!,My MB C200 2008 has a problem;,- The tail light (hazard light) right or left stop working AFTER a while, then when I turn off and turn on the car (engine) it works normally for a period of time.,Some times the fuel marker stopts working too.,I notice that if it is too hot, like 100 F° or 35 C° (I live in Brazil) the problem is harder. Looks like some piece stops working  and get works normally after turn off the engine.,I dropped the car at 2 garages but always the same problem, thay say that uses the scaner (do not know de kind).,I made a video to show the problem, attached.,Im really disappointed!",#1,,NA,NA,NA,NA,2,0,,,NA
Mercedes-Benz,e class 220 diesel 2014 modell year,post-848287,"Aug 12, 2017",ismail2007,Hello can someone tell me please exact how many oxygen sensors the e 220 diesel have and or lambda probes and their location?is the oxygen sensor and lambda probe the same? i have tried to locate in the epc but cant find information.any pics will help .thank you in advance,#1,,NA,NA,NA,NA,1,0,,,NA
Mercedes-Benz,Did I find something special?,post-837082,"May 14, 2017",MikeJ,Why does it have Swedish plates?,#2,,"Jun 19, 1978
										
											(Age: 44)","Oulu, Finland",NA,"Accountant, translator","3,242","1,827","Skoda Octavia vRS,Skoda Fabia Combi Sport,Saab 9-3","I'm a lot of things.,Don't ask the world to change - you change first.",NA
Mercedes-Benz,(W222) Active Bonnet Triggered,post-820790,"Jan 8, 2017",WAND,"Mercedes-Benz,""After triggering, the bonnet can be reset for the journey to the qualified workshop. There, the actuators need to be replaced.""",#5,,,Belgrade,Male,NA,"1,561","2,441",,,NA
Mercedes-Benz,Mercedes-Benz SLS AMG Picture Thread,post-411718,"Sep 15, 2009",Tarek,"On the downside the convertible won't have those doors!,Very happy with this car and the more extreme version with the new insane engines is gonna be pure demolition!",#17,post: 411691,,Cairo.,NA,Dentist,"9,862","2,291",Italian.,,NA
Mercedes-Benz,Mercedes-Benz SLS AMG Picture Thread,post-410723,"Sep 11, 2009",Der Hofmeister,"You wanted more pics, here you have them",#13,post: 410660,April 26,"Bucharest, Romania",Male,Credit Risk Analyst,885,"1,867","2014 BMW 320d xDrive (F30),2012 BMW 116i 3dr (F21),2004 Chevrolet Kalos SX 1.4 (2004),2006 Volkswagen Passat Variant (B6) 2.0 TDI BKP (6-speed DSG),2009 BMW 525xd LCI (E60 LCI)",,NA
Mercedes-Benz,Mercedes-Benz SLS AMG Picture Thread,post-414279,"Sep 27, 2009",m-power,"Anybody have those pictures in high res ????,[image no longer available],[image no longer available],[image no longer available],[image no longer available],[image no longer available],[image no longer available]",#34,,"Aug 12, 1979
										
											(Age: 43)",NA,NA,General Surgeon,"1,016","1,114",BMW 530i,Photography,NA
Mercedes-Benz,Mercedes-Benz SLS AMG Picture Thread,post-417520,"Oct 11, 2009",loco@circo,"Some more from the IAA (reduced to 50% of original size):,[image no longer available][image no longer available][image no longer available][image no longer available][image no longer available][image no longer available][image no longer available][image no longer available][image no longer available][image no longer available][image no longer available][image no longer available]",#40,,NA,NA,NA,student of social science,70,18,E36 318is,,NA
Mercedes-Benz,Mercedes-Benz SLS AMG Picture Thread,post-421910,"Nov 1, 2009",GBOY,Welcome to reality,#51,,,"Washington, DC",NA,Art Director,"1,171","1,146","S550 AMG Sport,G550 ...,SL 500 ...,Honda Shadow VT1100,08 Range Rover,04 Range Rover,S430 Sport,CLK320,W202 C Class,Lexus LX450,Mitsubishi 3000GT,S-Coupe Cabriolet","Cars, Pool, Tennis,07 S550 4m Sport * 2011 G550 * 04 SL 500 * Honda Shadow VT1100",NA
Mercedes-Benz,Mercedes-Benz SLS AMG Picture Thread,post-425179,"Nov 22, 2009",BVC500,"You think Mercedes would have designed the rear bumper better to accommodate the US style license plate.  I can understand the bumperettes, but not how the plate covers the reverse light.",#73,,NA,NA,NA,NA,105,84,,,NA
Mercedes-Benz,Anniversary of a life-saving innovation: The airbag entered production 30 years ago,post-487510,"Nov 2, 2010",Michael,"That is something that makes us all wonder but puts us to rest.  I hope that I am never in any serious car accident.  However, knowing that my car is equipped with airbags puts me, slightly, at ease.  Just a scary thing as a whole.  Airbags save your life, but they also hurt when they slap you in the face and/or arm.  Hopefully no  one here will experience that.",#11,post: 482558,"Jun 14, 1984
										
											(Age: 38)",NA,NA,NA,"4,640",662,BMW M3 or Ferrari 458,Take a look at my portfolio,NA
Mercedes-Benz,Anniversary of a life-saving innovation: The airbag entered production 30 years ago,post-482558,"Sep 27, 2010",Makini,"Knock-on-wood, i've driving for the past 22 years (16 years officially,) and i've never been in anything more than a fender bender! But, when my big one comes, and it will here in Nairobi, I'm glad my current car has more 'Airbag' tags than I can count...",#10,,May 7,Nairobi.,Male,Marketer.,316,107,"2015 Volkswagen Tiguan Sport & Style 2.0TSI DSG,2013 Volkswagen Amarok HL Bi-TDI AG8,2009 Volwagen Touareg 3.0 V6 TDI AG6,2011 Volkswagen Passat CC 1.8TSI DSG-7,2005 Volkswagen Passat Variant 1.8T MT,1990 Nissan Bluebird RU12 2.0 SSS.,1997 Subaru Impreza WRX Hatchback.,2003 Volkswagen Jetta Highline 1.9 TDI.,2006 Volkswagen Touareg 2.5R5 TDI AG6,2007 Volkswagen Passat Comfortline 2.0 TDI.,2014 Volkswagen Tiguan S&S 2.0 TSI DSG,(Bike) Honda CB1000R",Speak softly but carry a big stick...,NA
Mercedes-Benz,2005 G55 Grand Edition,post-759693,"Aug 21, 2015",Suhail Siddiqi,"Slowly I have been learning to drive the G55, as efficiently as possible.,Last month, I was able to get 13.9 MPG, on mostly city driving. I am planning a 500 miles plus trip, I will see if I can Average 14.2, let's see keep you posted,Sorry the car is  2005",#1,,,California,Male,Self Employed,9,1,,,NA
Mercedes-Benz,Future Classic: 1998 Mercedes E55 AMG W210,post-759751,"Aug 22, 2015",DJRaze99,Mercedes E55 T AMG.,#3,,"Feb 1, 1991
										
											(Age: 32)",Poland,Male,NA,"1,029","3,662",Mercedes S 65 AMG W220,,NA
Motorsports,Drive the Ferrari F1 car.... in GT5 Prologue!,post-285763,"Mar 14, 2008",Rengoku,"Sorry if I'm too excited, but this news just blew my mind.",#1,,"Mar 21, 1984
										
											(Age: 39)","Toronto, Canada",NA,NA,65,61,,,NA
Mercedes-Benz,Mercedes-Benz SLS AMG Picture Thread,post-810122,"Oct 11, 2016",Rainer271,,#172,,,Germany,Male,NA,"11,239","19,367",,"Regards, Rainer",NA
Motorsports,Will you watch Melbourne GP live ?,post-284927,"Mar 12, 2008",chonkoa,I think I am going to watch all sessions.,#20,,,Houston & Calgary,NA,Engineer,"3,941","2,267","X5 4.8i/X6 50i,Chevy Sliverado,2004 Honda Accord, 2005 Toyota RAV4, 2006 330i,2010 Chevy Silverado,BMW CS(I am waiting BMW)","Golf, Car racing,Football: Arsenal FC fan",NA
Motorsports,Will you watch Melbourne GP live ?,post-285306,"Mar 13, 2008",Habitual Speeder,"I'll be watching the race...I doubt I'll have time to watch anything else.,Having said that, Ecclestone is a complete jackass.  Good job on alienating your fans in North America, Bernie!,Read this:,For the past 5 years, I've been attending a launch party hosted by a motorsports paraphenalia shop (Toronto Motorsports).  We have the party in a restaurant, where we can watch the race, while eating & drinking.,It used to work out quite well for the Australian race, as it used to start at 11pmEDT.  Now, the bloody race won't start until 12:30amEDT.  Still not awful (here, in Ontario, we have a useless law that stops alcohol sales at 2am), but it'll get worse if his silly idea of a night race is realized.",#25,,,"Ottawa, Canada",NA,NA,"1,396",319,"Own: 2005 Honda Civic SE,Drive: Whatever I decide to take off the lot","""Why is one driver faster than another? He's got more confidence. Sometimes, he gets it by over-riding certain fears & getting away with it. That lures you on."" - Mario Andretti",NA
Motorsports,Will you watch Melbourne GP live ?,post-284932,"Mar 12, 2008",pablodav,"FOr me will be at 4am, but be sure i will be awake. So anxious for the new season",#21,,,"Madrid, Spain",NA,NA,39,51,"VW Eos 2.0 FSI,Mercedes E270 CDI,There are a lot",,NA
Mercedes-Benz,Mercedes-Benz S-Class by Dynasty Auto Design,post-716815,"Oct 14, 2014",hannaz,"Mercedes Benz introduced the new generation S Class last year and the S Class retained the best luxury car in the world tag. The response for the S Class around the world is very high and the company is not able to meet the demand. Mercedes will soon introduce the extra long wheel base models officially for the customers who want more comfort, but some modifying companies have already begun introducing their own stretched version of the S Class. We have stumbled upon this S Class stretched version image in the instagram. This S Class stretched version is designed by the Dyansty Auto Design in California. Dynasty has already done the stretched version of various models like the Range Rover and many more.,http://fly-wheel.com/mercedes-benz-s-class-stretched-version-by-dynasty-auto-design/",#1,,"May 22, 1981
										
											(Age: 42)","Calicut, Kerala, India",Male,Auto-Journalist,"4,357","8,202","Mercedes Benz G-Wagon (300GD, W460),,Royal Enfield Bullet (1958),Mercedes Benz 220D (W115, 1968), E250D (W124), E250 (W210), 190 (W201),Range Rover (1985), Suzuki Gypsy (Samurai),Mercedes-Maybach S650, new G-Class, AMG S65 , G-Professional, G63 6x6, SLR, Unimog, Arocs SLT 8x8.","Auto Journalist by profession, Passionate auto-lover by heart.,Juror - WCOTY (World Car Awards),Chief Editor - Fly Wheel Automotives.,Power of Passion - facebook.com/HanMust",NA
Mercedes-Benz,Sport Auto Supertest - Mercedes-Benz SLS AMG Black Series,post-716753,"Oct 14, 2014",Toldi911,Nice SLS AMG Black Series near Stuttgart:,#21,,NA,NA,NA,NA,350,373,,www.youtube.com/user/DrGumoLunatic www.autobahnspeedhunter.com,NA
Mercedes-Benz,The most loved car company......Guess,post-709288,"Aug 27, 2014",Germany10,Those babes create addiction !!!,#3,post: 709222,January 10,NA,Male,NA,33,10,,,NA
Mercedes-Benz,NEW Mercedes Benz SL 63 AMG 2012 / 2013 - R231 series - ON THE ROAD,post-579772,"May 22, 2012",-=Hot|Ice=-,,#3,,,In my Empire.,Male,Dreaming.,"2,172","1,227","2018 Audi S5 Coupe,2013 BMW M3 Coupe,2009 Kawasaki ZX-6R,2008 BMW 328xi Coupe,Too many to list.",I like being me.,NA
Mercedes-Benz,NEW Mercedes Benz SL 63 AMG 2012 / 2013 - R231 series - ON THE ROAD,post-573174,"Apr 8, 2012",snksnok,King of roed,#2,,NA,NA,NA,NA,56,72,,,NA
Mercedes-Benz,"2014 S-Class, in depth review",post-698652,"Jun 3, 2014",ZicZachZo,"Looks really good. BTW, Motorweek, god bless it, needs an update!!",#3,,"Mar 20, 1987
										
											(Age: 36)",United Kingdom,Male,NA,"1,108",520,"2019 VW e-Golf,'90 Mercedes Benz 190E 2.6,Porsche 911, Mercedes S205 C63",,NA
Mercedes-Benz,Exclusive collector’s item: The new SLS AMG GT3 ”45th ANNIVERSARY”,post-604716,"Oct 22, 2012",tennmb,Does it come with a helmet?,#5,,"Sep 8, 1970
										
											(Age: 52)",NA,Male,NA,"1,661","1,071",,,NA
Motorsports,DTM final race @ Hockenheimring! (Fitty Six Kays chillax),post-241999,"Oct 17, 2007",cawimmer430,,#6,,"Jul 31, 1982
										
											(Age: 40)","Munich, Germany",NA,"Photographer, Graphic Designer","14,816","13,252","'07 BMW 118i,1936 Mercedes-Benz 500K Spezial Roadster","Mercedes-Benz, Photoshop (Digital Imaging), Reading, Dogs, Athletics, Sleeping, Drawing &amp; Eating!!!,CHRISTIAN WIMMER,WIMMERFOTOGRAFIE.de | www.facebook.com/wimmerfotografie | IG: wimmerfotografie",NA
Motorsports,"'Ring visit, the third installment",post-214976,"Aug 2, 2007",audi_rudy,"you may not think that these photos are up to your standards but i find them amazing.,Sounds like you had fun in the porsche and everything.  There really are some amazing cars at the ring i hope to someday make it there",#6,,"Nov 9, 1991
										
											(Age: 31)","Rhode island, USA",NA,high school,"1,674",307,,"cars, sports, school, speed skating",NA
Mercedes-Benz,Classic Mercedes-Benz photos,post-330219,"Sep 17, 2008",Jackbmw,"The car which is now famous in whole Poland probably. Its first owner was Stanislaw Lem, a worldwide famous SF books author:,The car is now for sale at the auction portal and all the income will be given to charity supporting uncurably ill children.,Some details about the car:,- Mercedes 280 SE,- 2.8 liter motor,- 185 bhp,- produced in 1981,- mileage 109 000 km,- all the time in possesion of the family Lem,- still with original plates,- bought in Western Berlin as a new car,- still has got the original paintwort,Some pics (more at the auction):,[image no longer available],[image no longer available],[image no longer available],[image no longer available],[image no longer available],[image no longer available],[image no longer available],[image no longer available],[image no longer available],[image no longer available],The car costs now almost 10000 Euros,- 1 Euro = 3,3zł,P. S. Does anyone know how this paintwork colour is called?",#78,,,Not there where I'd like to,NA,Software engineer - developing soft for VW &amp; A,161,166,"Moreagrün BMW 320i sedan, Jan '96,None - my Bimmer is my first car,BMW 335i Coupe with M Package","BMWs, Modelcars, IT,The Ultimate Driving Machine",NA
